{
  "$schema": "../../../../../../../../schemas/part_manifest.schema.json",
  "schema_version": "1.0.0",
  "content_version": "1.0.0",
  "module_id": "physics",
  "section_id": "electricity",
  "package_id": "page_001",
  "part_id": "charge_intro",
  "title": "Charge & Circuits",
  "part_type": "text",
  "content": {
    "asset_path": "assets/electricity_charge_intro.md",
    "format": "markdown"
  }
}
