{
  "$schema": "../../../../../../../../schemas/part_manifest.schema.json",
  "schema_version": "1.0.0",
  "content_version": "1.0.0",
  "module_id": "physics",
  "section_id": "motion",
  "package_id": "page_001",
  "part_id": "gravity_demo",
  "title": "Gravity Drop Demo",
  "part_type": "simulation",
  "content": {
    "asset_path": "assets/gravity_demo.md",
    "format": "markdown"
  },
  "behavior": {
    "preset": "gravity-demo",
    "parameters": {
      "gravity_m_s2": 9.81,
      "initial_height_m": 10,
      "time_step_s": 0.05
    }
  }
}
