{
  "$schema": "../../../../../../../../schemas/part_manifest.schema.json",
  "schema_version": "1.0.0",
  "content_version": "1.0.0",
  "module_id": "physics",
  "section_id": "optics",
  "package_id": "page_001",
  "part_id": "lens_ray_demo",
  "title": "Lens Ray Lab",
  "part_type": "simulation",
  "content": {
    "asset_path": "assets/lens_ray_demo.md",
    "format": "markdown"
  },
  "x_extensions": {
    "guides": {
      "learner": "assets/lens_ray_guide_learner.md",
      "educator": "assets/lens_ray_guide_educator.md",
      "explorer": "assets/lens_ray_guide_explorer.md"
    },
    "lab": {
      "lab_id": "lens_ray"
    }
  }
}
