{
  "$schema": "../../../../../../../../schemas/part_manifest.schema.json",
  "schema_version": "1.0.0",
  "content_version": "1.0.0",
  "module_id": "physics",
  "section_id": "optics",
  "package_id": "page_001",
  "part_id": "light_intro",
  "title": "Light & Reflection",
  "part_type": "text",
  "content": {
    "asset_path": "assets/optics_light_intro.md",
    "format": "markdown"
  }
}
